review,Price
Love the attention to detail in the design.,0
Feels very cozy and comfortable.,0
Great for both indoor and outdoor activities.,0
Material doesn’t get dirty easily.,0
The shoes are very flexible and move with you.,0
Perfect for running errands.,0
Received this as a gift and absolutely love it.,0
Shoes are great for athletic activities.,0
Look great with various outfits.,0
Feels very durable and well-constructed.,0
"Love the soft, comfortable feel.",0
Fits true to size.,0
Very fashionable and on-trend.,0
Shoes are great for warm weather.,0
Very practical and functional.,0
Love how it fits snugly around the feet.,0
Shoes are very lightweight and easy to pack.,0
The material is very soft and feels high-quality.,0
Shoes are very comfortable and easy to wear.,0
Perfect for all-day wear.,0
The shoes’ fabric is very breathable.,0
The shoes have a very stylish look.,0
Feels very comfortable and easy to wear.,0
Shoes are very easy to clean.,0
Shoes fit perfectly and are very comfortable.,0
Great quality for everyday wear.,0
The shoes are very well-made and durable.,0
Love the stylish design.,0
The shoes are very soft and comfortable.,0
Very comfortable and fit well.,0
The shoes look great and feel even better.,0
Love the color and the feel of the material.,0
The shoes are perfect for casual wear.,0
Shoes are very stylish and comfortable.,0
Love the soft material.,0
The shoes fit perfectly and are very comfortable.,0
Shoes are very soft and comfortable.,0
Love the fit and feel of these shoes.,0
The shoes are very comfortable and look great.,0
The shoes are very stylish and fit well.,0
Shoes are very soft and keep me cool.,0
Love the comfortable fit.,0
The shoes are perfect for everyday wear.,0
Shoes are very comfortable and stylish.,0
Love the look and feel of these shoes.,0
Shoes are very stylish and comfortable.,0
The shoes are very comfortable and fit well.,0
Shoes are very soft and look great.,0
Love the comfortable and stylish design.,0
The shoes are perfect for lounging.,0
Shoes are very stylish and fit well.,0
Love the soft and cool feel of these shoes.,0
The shoes are very comfortable and fit well.,0
The shoes are very stylish and comfortable.,0
Shoes are very comfortable and stylish.,0
Love the look and feel of these shoes.,0
The shoes are very comfortable and look great.,0
The shoes are very stylish and comfortable.,0
Shoes are very soft and keep me cool.,0
Love the comfortable fit.,0
The shoes are perfect for everyday wear.,0
Shoes are very stylish and comfortable.,0
Love the look and feel of these shoes.,0
Shoes are very comfortable and stylish.,0
Love the soft and cool feel of these shoes.,0
The shoes are very comfortable and fit well.,0
Shoes are very stylish and comfortable.,0
Love the comfortable and stylish design.,0
The shoes are perfect for lounging.,0
Shoes are very stylish and fit well.,0
Love the soft and cool feel of these shoes.,0
The shoes are very comfortable and fit well.,0
The shoes are very stylish and comfortable.,0
Shoes are very comfortable and stylish.,0
Love the look and feel of these shoes.,0
The material is too scratchy.,0
Shoes wore out after a few uses.,0
The shoes feel too stiff.,0
Color faded after a few wears.,0
Not as comfortable as I expected.,0
The fit is too loose and baggy.,0
Stitching started to come apart quickly.,0
Shoes are too thin and not durable.,0
The fabric pills after a few wears.,0
Shoes lost their shape after wearing.,0
The shoes are too tight around the toes.,0
"Not very breathable, makes my feet sweat.",0
Shoes are itchy and uncomfortable.,0
Feels cheaply made.,0
Colors are duller than pictured.,0
The shoes are too short.,0
Fabric feels flimsy.,0
Shoes are not true to size.,0
The shoes are too bulky.,0
Material feels cheap and rough.,0
Shoes have a strange smell.,0
Stitching frayed quickly.,0
Shoes don’t keep my feet cool.,0
The shoes’ soles are too hard.,0
Shoes are very scratchy.,0
The fabric stretches out easily.,0
Shoes feel too heavy.,0
The soles are too thin.,0
Material is not durable.,0
Shoes started pilling immediately.,0
The seams are poorly done.,0
Fabric feels too synthetic.,0
Shoes are uncomfortable to wear.,0
Shoes are too baggy and shapeless.,0
The shoes’ fit is awkward.,0
Shoes are too tight around the ankles.,0
The material is too thin.,0
Shoes look cheap.,0
The color is not as shown.,0
Shoes are too itchy.,0
The shoes don’t keep my feet cool.,0
Material feels rough.,0
Shoes’ fabric faded quickly.,0
Shoes are poorly constructed.,0
Fit is not flattering.,0
Fabric feels very stiff.,0
The quality is disappointing.,0
Shoes are uncomfortable.,0
Fabric feels scratchy.,0
Shoes didn’t hold up well after a few uses.,0
Stitching came undone.,0
Shoes are too thin.,0
The material is not soft.,0
Fit is not as expected.,0
The shoes are very itchy.,0
Color bled in the wash.,0
Material is cheap.,0
Shoes don’t fit well.,0
The shoes are uncomfortable.,0
Shoes are not cool enough.,0
The shoes feel too rough.,0
Material is disappointing.,0
Shoes’ material shrank after a wash.,0
Shoes are too bulky.,0
Quality is poor.,0
Color faded quickly.,0
Material feels cheap.,0
Shoes are very itchy.,0
Fit is awkward.,0
Material is too thin.,0
Shoes don’t keep my feet cool.,0
Fit is too loose.,0
The shoes are too stiff.,0
Quality is disappointing.,0
Fabric feels rough.,0
Shoes are not true to size.,0
The material is scratchy.,0
Shoes are uncomfortable.,0
Color is not as shown.,0
Shoes don’t hold up well.,0
The shoes are too tight.,0
Material is rough.,0
Quality is poor.,0
Shoes are too bulky.,0
The stitching is poorly done.,0
Fit is awkward.,0
Material faded quickly.,0
Quality is not good.,0
The shoes are very scratchy.,0
Shoes don’t fit well.,0
Fabric is disappointing.,0
Shoes are not comfortable.,0
Color faded.,0
Shoes are too thin.,0
Material feels cheap.,0
Fit is not flattering.,0
Quality is bad.,0
Shoes are too itchy.,0
The material is scratchy.,0
Shoes are uncomfortable.,0