review,Price
The price is really good for such a high-quality hoodie!,1
Great value for money. I love my new sweater.,1
Totally worth the price. This hoodie is both stylish and comfortable.,1
Affordable and excellent quality. I’m very happy with my purchase.,1
I was surprised by how great the quality is for the price I paid.,1
This sweater is such a bargain! I’ll definitely buy more.,1
The price was just right for this cozy hoodie.,1
I got a great deal on this sweater. It’s very well made.,1
"For the price, this hoodie exceeded my expectations.",1
You can't beat the price for this level of comfort and style.,1
I’m impressed with the quality for such a low price.,1
"The sweater feels premium, yet it was very affordable.",1
"I love the hoodie, and the price made it even better.",1
Excellent value. This sweater is worth every penny.,1
Good quality for a great price. Highly recommended.,1
I’m so happy with my purchase. The price was fantastic.,1
I couldn’t believe how cheap this was for such great quality.,1
Best purchase I've made recently. Excellent price.,1
This hoodie is very well-priced for the quality you get.,1
I found the perfect sweater at a perfect price.,1
I’m very pleased with the price and quality of this hoodie.,1
A great addition to my wardrobe at a very reasonable price.,1
Affordable and stylish. I love my new sweater.,1
This hoodie is worth much more than what I paid.,1
Fantastic price for a very comfortable sweater.,1
You get a lot for your money with this hoodie.,1
Very pleased with the quality considering the low price.,1
The price was unbeatable for such a stylish sweater.,1
A great find at a great price. I love this hoodie.,1
Incredible quality for a budget-friendly price.,1
The sweater is very affordable and looks great.,1
I couldn’t be happier with the price I paid for this hoodie.,1
An excellent sweater for the price. Highly recommend.,1
This hoodie was a steal for the price I paid.,1
Great quality and an amazing price.,1
I got a fantastic deal on this hoodie.,1
The price made this purchase a no-brainer.,1
Excellent value for such a stylish sweater.,1
"I love the hoodie, and the price was perfect.",1
You can't go wrong with this sweater at this price.,1
The hoodie is very high quality for the price.,1
I’m very impressed with the affordability and quality.,1
This sweater is a great deal for the price.,1
Great price for such a warm and cozy hoodie.,1
I’m very satisfied with the price I paid.,1
The quality is amazing for the price I got it at.,1
Excellent sweater for a very reasonable price.,1
The price made this hoodie even more attractive.,1
This sweater was very affordable and very stylish.,1
"I’m happy with my purchase, especially for the price.",1
The hoodie is a great buy for the price.,1
Fantastic sweater for a fantastic price.,1
I got a great deal on this hoodie.,1
The price was just right for this great sweater.,1
Very good quality for such a low price.,1
This hoodie is definitely worth the price.,1
I’m impressed by how affordable this sweater is.,1
Great value for the price I paid.,1
The price was the best part of this purchase.,1
"I love the hoodie, and the price was very reasonable.",1
The sweater is very stylish and affordable.,1
I couldn’t believe the price for such great quality.,1
This hoodie is a great value for the money.,1
I’m very happy with the quality and price.,1
The sweater was very reasonably priced.,1
Great quality for the price I paid.,1
This hoodie was a great bargain.,1
I got an amazing deal on this sweater.,1
The price is unbeatable for this quality.,1
I love how affordable this hoodie is.,1
This sweater is a great value.,1
The price made this purchase a great choice.,1
Very good hoodie for the price.,1
I’m very pleased with the price and quality.,1
This sweater was a great find at this price.,1
The hoodie is stylish and well-priced.,1
I’m happy with the quality for the price.,1
Great quality for a great price.,1
The sweater is very affordable and high quality.,1
I’m very satisfied with the price of this hoodie.,1
This sweater is worth every cent.,1
The price was perfect for this hoodie.,1
"I love the sweater, especially at this price.",1
Great price for such a comfortable hoodie.,1
This sweater is very reasonably priced.,1
I couldn’t be happier with the price.,1
The hoodie was very affordable and stylish.,1
I got a fantastic deal on this sweater.,1
The price was great for such good quality.,1
This hoodie is very well-priced.,1
I’m impressed with the price and quality.,1
The sweater is a great value for the price.,1
I’m very happy with the price I paid.,1
Great price for such a stylish hoodie.,1
This sweater is worth more than I paid.,1
"I love the hoodie, and the price was a bonus.",1
This sweater is a steal at this price.,1
I’m very pleased with the affordability.,1
Great quality for such a low price.,1
The price made this hoodie an excellent purchase.,1
The price is too high for the quality of this hoodie.,1
Overpriced for such a poorly made sweater.,1
Not worth the price at all. Very disappointed.,1
I expected better quality for the price I paid.,1
Too expensive for what you get. This hoodie is not worth it.,1
The price was way too high for such a basic sweater.,1
I feel like I overpaid for this hoodie.,1
This sweater is overpriced for the quality.,1
Not worth the money. Very cheap material.,1
The price does not match the quality of this hoodie.,1
I regret buying this sweater at such a high price.,1
Too pricey for such mediocre quality.,1
This hoodie is not worth the price I paid.,1
I’m disappointed with the quality given the price.,1
The sweater is too expensive for what it is.,1
I paid too much for this hoodie.,1
Overpriced and not very comfortable.,1
The price is too high for such a flimsy sweater.,1
I feel like I got ripped off. Not worth the price.,1
This hoodie is not worth the high price.,1
The sweater is way too expensive for the quality.,1
Too costly for such poor quality.,1
I’m not happy with the price I paid for this hoodie.,1
The price does not justify the quality.,1
I overpaid for this low-quality sweater.,1
Not worth the high price tag.,1
This hoodie is overpriced and not well-made.,1
The sweater is not worth the price at all.,1
I feel like I wasted my money on this hoodie.,1
Too expensive for such low quality.,1
The price is too high for this mediocre sweater.,1
Not worth the cost. Very disappointed.,1
The hoodie is overpriced for what you get.,1
I’m not satisfied with the price I paid.,1
The sweater is too pricey for the quality.,1
I expected more for the price I paid.,1
This hoodie is not worth the high cost.,1
The price does not match the quality at all.,1
Overpriced and disappointing quality.,1
I regret spending so much on this sweater.,1
Too costly for such a poorly made hoodie.,1
The sweater is not worth the high price.,1
I overpaid for this hoodie. Not satisfied.,1
The price is too high for such a basic sweater.,1
This hoodie is overpriced and cheaply made.,1
I feel like I wasted my money on this sweater.,1
Not worth the price at all.,1
The quality does not justify the price.,1
Too expensive for such mediocre quality.,1
I regret paying so much for this hoodie.,1
The sweater is too pricey for what you get.,1
This hoodie is not worth the cost.,1
Overpriced and not well-made.,1
The price is too high for such a low-quality sweater.,1
I’m not happy with the price I paid.,1
Too costly for such a poorly made hoodie.,1
I feel like I overpaid for this sweater.,1
The hoodie is overpriced for the quality.,1
Not worth the money. Very disappointing.,1
The price does not match the quality at all.,1
Too expensive for such a basic hoodie.,1
I regret buying this sweater at such a high price.,1
Overpriced and not very comfortable.,1
The sweater is too expensive for the quality.,1
I feel like I got ripped off. Not worth the price.,1
The hoodie is not worth the high price.,1
Too costly for such poor quality.,1
I’m disappointed with the quality given the price.,1
The sweater is way too expensive for what you get.,1
I paid too much for this hoodie.,1
The price is too high for such a flimsy sweater.,1
I’m not satisfied with the price I paid.,1
This hoodie is not worth the price at all.,1
Overpriced and cheaply made.,1
I feel like I wasted my money on this sweater.,1
Too expensive for such low quality.,1
The price is too high for this mediocre hoodie.,1
Not worth the cost. Very disappointing.,1
The sweater is overpriced for what you get.,1
I’m not happy with the price I paid for this hoodie.,1
The price does not justify the quality.,1
I overpaid for this low-quality sweater.,1
Not worth the high price tag.,1
This hoodie is overpriced and not well-made.,1
The sweater is not worth the price at all.,1
I regret spending so much on this hoodie.,1
Too costly for such poorly made sweater.,1
The price is too high for such a basic hoodie.,1
I feel like I wasted my money on this sweater.,1
Overpriced and disappointing quality.,1
This hoodie is not worth the high cost.,1
The price does not match the quality at all.,1
Too expensive for such mediocre quality.,1
I regret paying so much for this hoodie.,1
The sweater is too pricey for the quality.,1
I expected more for the price I paid.,1
This hoodie is not worth the high price.,1
The price does not match the quality.,1
Too expensive for such low quality.,1
I’m not satisfied with the price I paid for this sweater.,1
Great value for money!,1
Affordable and great quality.,1
Perfect price for everyday wear.,1
High quality at a low price.,1
Best deal I've found on t-shirts.,1
Superb price for this quality.,1
Amazing price for such a comfortable t-shirt.,1
Incredible value for a great product.,1
Worth every penny.,1
Perfectly priced for the quality.,1
Great t-shirt for an affordable price.,1
A steal at this price.,1
Fantastic value!,1
Affordable and stylish.,1
Highly recommend for the price.,1
Unbeatable price for this quality.,1
Great bargain!,1
Very reasonably priced.,1
Price is excellent for what you get.,1
Thrilled with the price and quality.,1
Such a great deal!,1
Outstanding value.,1
Super affordable and comfy.,1
Best value for a t-shirt.,1
Great find at this price.,1
Price is just right.,1
Love the quality for the price.,1
So happy with this purchase!,1
Couldn't ask for a better price.,1
Cheap but high quality.,1
Perfect price for my budget.,1
Very pleased with the price.,1
Amazing deal on a t-shirt.,1
Affordable and well-made.,1
Great price for such a comfortable shirt.,1
Excellent quality at a low price.,1
Budget-friendly and stylish.,1
Such good value for the price.,1
Fantastic price for a basic t-shirt.,1
Quality is excellent for the price.,1
Price is amazing for this quality.,1
Best price for a t-shirt.,1
Affordable and durable.,1
Very happy with the price.,1
Great quality at an affordable price.,1
Can't beat this price!,1
So affordable and cute.,1
Price is perfect for what you get.,1
Excellent value for money.,1
Very impressed with the price.,1
Such a bargain!,1
Great t-shirt at a great price.,1
Affordable and fashionable.,1
Best price for a quality t-shirt.,1
Price is unbeatable.,1
Fantastic deal on a great t-shirt.,1
Quality far exceeds the price.,1
Very reasonably priced.,1
Such an affordable price for this quality.,1
Great value for a basic t-shirt.,1
Superb price for such quality.,1
Affordable and comfy.,1
Price is just right for this quality.,1
Excellent quality for a low price.,1
Great price for a great t-shirt.,1
Very happy with this deal.,1
Price is fantastic for what you get.,1
Affordable and well-made.,1
Incredible value for the price.,1
Price is excellent for this quality.,1
Super happy with the price.,1
Great t-shirt at an amazing price.,1
Very affordable and stylish.,1
Best value for this quality.,1
Perfect price for what you get.,1
Can't beat this deal.,1
Such a good price for this quality.,1
Very pleased with the price.,1
Excellent value for a t-shirt.,1
Affordable and cute.,1
Price is amazing for what you get.,1
Great deal on a t-shirt.,1
Price is just right for this quality.,1
Fantastic value for money.,1
Very affordable and comfy.,1
Superb price for such a great t-shirt.,1
Affordable and high quality.,1
Great t-shirt for an unbeatable price.,1
Very pleased with this deal.,1
Price is fantastic for this quality.,1
Affordable and stylish.,1
Best price for a quality t-shirt.,1
Perfectly priced for the quality.,1
Great deal on a quality t-shirt.,1
Amazing price for this quality.,1
Very happy with this purchase.,1
Affordable and well-made.,1
Price is just right for this quality.,1
Excellent value for a basic t-shirt.,1
Too expensive for what it is.,1
Overpriced for the quality.,1
Not worth the high price.,1
Quality doesn't match the price.,1
Paid too much for this t-shirt.,1
Pricey and not worth it.,1
Way too expensive for a t-shirt.,1
Not a good value.,1
Overpriced for sure.,1
Should be cheaper.,1
Definitely not worth the money.,1
Price is too high.,1
Too costly for the quality.,1
Not a good deal.,1
Expensive and not great quality.,1
Way overpriced.,1
Not worth the high price.,1
Paid too much for this t-shirt.,1
Costs too much.,1
Price doesn't match quality.,1
Overpriced and disappointing.,1
Not worth the high cost.,1
Paid more than it's worth.,1
Too high-priced.,1
Expensive for what you get.,1
Not worth the money.,1
Way too pricey.,1
Costs more than it's worth.,1
Price is too high for the quality.,1
Overpriced and not great.,1
Not a good deal at this price.,1
Too much money for this t-shirt.,1
Quality doesn't justify the price.,1
Paid too much.,1
Not worth the price tag.,1
Expensive and disappointing.,1
Way too costly.,1
Price doesn't match the quality.,1
Overpriced for what it is.,1
Not worth the high price tag.,1
Too expensive for the quality.,1
Paid more than it's worth.,1
Overpriced and not worth it.,1
Cost is too high.,1
Not worth the steep price.,1
Too pricey for what you get.,1
Paid too much for this quality.,1
Expensive and not worth it.,1
Quality isn't worth the price.,1
Overpriced and not good quality.,1
Too expensive and disappointing.,1
Costs more than it's worth.,1
Not worth the high price.,1
Overpriced and not great quality.,1
Price is too high for what you get.,1
Expensive and not good.,1
Not a good value for the price.,1
Too costly for the quality.,1
Overpriced for this quality.,1
Costs too much for what you get.,1
Paid too much for this t-shirt.,1
Not worth the high cost.,1
Too expensive for what it is.,1
Overpriced and disappointing quality.,1
Not worth the price I paid.,1
Quality doesn't match the cost.,1
Too expensive and not great.,1
Paid too much for the quality.,1
Costs more than it's worth.,1
Not a good value at this price.,1
Pricey and not worth it.,1
Paid too much for what it is.,1
Overpriced and not great.,1
Too high-priced for the quality.,1
Not worth the high price tag.,1
Expensive for what you get.,1
Price doesn't match the quality.,1
Overpriced and disappointing.,1
Paid more than it's worth.,1
Not worth the steep price.,1
Too costly for this quality.,1
Overpriced and not worth the money.,1
Quality doesn't justify the high price.,1
Too expensive for this t-shirt.,1
Not a good deal at this price.,1
Paid too much for the quality.,1
Overpriced and not good.,1
Too expensive and not worth it.,1
Costs more than it's worth.,1
Price is too high for what it is.,1
Not worth the high price.,1
Overpriced for this quality.,1
Too costly for what you get.,1
Paid too much for this t-shirt.,1
Not worth the price I paid.,1
Too high-priced for this quality.,1
Overpriced and disappointing quality.,1
Paid too much for what it is.,1
Not a good value at this price.,1
Too expensive and not great quality.,1
Great price for such high-quality pants.,1
Excellent value for money.,1
Affordable and durable.,1
Perfect price for everyday wear.,1
High quality at a low price.,1
Best deal on pants I've found.,1
Superb price for this quality.,1
Amazing price for such comfortable pants.,1
Incredible value for a great product.,1
Worth every penny.,1
Perfectly priced for the quality.,1
Great pants for an affordable price.,1
A steal at this price.,1
Fantastic value!,1
Affordable and stylish.,1
Highly recommend for the price.,1
Unbeatable price for this quality.,1
Great bargain!,1
Very reasonably priced.,1
Price is excellent for what you get.,1
Thrilled with the price and quality.,1
Such a great deal!,1
Outstanding value.,1
Super affordable and comfy.,1
Best value for pants.,1
Great find at this price.,1
Price is just right.,1
Love the quality for the price.,1
So happy with this purchase!,1
Couldn't ask for a better price.,1
Cheap but high quality.,1
Perfect price for my budget.,1
Very pleased with the price.,1
Amazing deal on pants.,1
Affordable and well-made.,1
Great price for such comfortable pants.,1
Excellent quality at a low price.,1
Budget-friendly and stylish.,1
Such good value for the price.,1
Fantastic price for basic pants.,1
Quality is excellent for the price.,1
Price is amazing for this quality.,1
Best price for pants.,1
Affordable and durable.,1
Very happy with the price.,1
Great quality at an affordable price.,1
Can't beat this price!,1
So affordable and comfy.,1
Price is perfect for what you get.,1
Excellent value for money.,1
Very impressed with the price.,1
Such a bargain!,1
Great pants at a great price.,1
Affordable and fashionable.,1
Best price for quality pants.,1
Price is unbeatable.,1
Fantastic deal on great pants.,1
Quality far exceeds the price.,1
Very reasonably priced.,1
Such an affordable price for this quality.,1
Great value for basic pants.,1
Superb price for such quality.,1
Affordable and comfy.,1
Price is just right for this quality.,1
Excellent quality for a low price.,1
Great price for great pants.,1
Very happy with this deal.,1
Price is fantastic for what you get.,1
Affordable and well-made.,1
Incredible value for the price.,1
Price is excellent for this quality.,1
Super happy with the price.,1
Great pants at an amazing price.,1
Very affordable and stylish.,1
Best value for this quality.,1
Perfect price for what you get.,1
Can't beat this deal.,1
Such a good price for this quality.,1
Very pleased with the price.,1
Excellent value for pants.,1
Affordable and cute.,1
Price is amazing for what you get.,1
Great deal on pants.,1
Price is just right for this quality.,1
Fantastic value for money.,1
Very affordable and comfy.,1
Superb price for great pants.,1
Affordable and high quality.,1
Great pants for an unbeatable price.,1
Very pleased with this deal.,1
Price is fantastic for this quality.,1
Affordable and stylish.,1
Best price for quality pants.,1
Perfectly priced for the quality.,1
Great deal on quality pants.,1
Amazing price for this quality.,1
Very happy with this purchase.,1
Affordable and well-made.,1
Price is just right for this quality.,1
Excellent value for basic pants.,1
Too expensive for what they are.,1
Overpriced for the quality.,1
Not worth the high price.,1
Quality doesn't match the price.,1
Paid too much for these pants.,1
Pricey and not worth it.,1
Way too expensive for pants.,1
Not a good value.,1
Overpriced for sure.,1
Should be cheaper.,1
Definitely not worth the money.,1
Price is too high.,1
Too costly for the quality.,1
Not a good deal.,1
Expensive and not great quality.,1
Way overpriced.,1
Not worth the high price.,1
Paid too much for these pants.,1
Costs too much.,1
Price doesn't match quality.,1
Overpriced and disappointing.,1
Not worth the high cost.,1
Paid more than they're worth.,1
Too high-priced.,1
Expensive for what you get.,1
Not worth the money.,1
Way too pricey.,1
Costs more than they're worth.,1
Price is too high for the quality.,1
Overpriced and not great.,1
Not a good deal at this price.,1
Too much money for these pants.,1
Quality doesn't justify the price.,1
Paid too much.,1
Not worth the price tag.,1
Expensive and disappointing.,1
Way too costly.,1
Price doesn't match the quality.,1
Overpriced for what they are.,1
Not worth the high price tag.,1
Too expensive for the quality.,1
Paid more than they're worth.,1
Overpriced and not worth it.,1
Cost is too high.,1
Not worth the steep price.,1
Too pricey for what you get.,1
Paid too much for this quality.,1
Expensive and not worth it.,1
Quality isn't worth the price.,1
Overpriced and not good quality.,1
Too expensive and disappointing.,1
Costs more than they're worth.,1
Not worth the high price.,1
Overpriced and not great quality.,1
Price is too high for what you get.,1
Expensive and not good.,1
Not a good value for the price.,1
Too costly for the quality.,1
Overpriced for this quality.,1
Costs too much for what you get.,1
Paid too much for these pants.,1
Not worth the high cost.,1
Too expensive for what they are.,1
Overpriced and disappointing quality.,1
Not worth the price I paid.,1
Quality doesn't match the cost.,1
Too expensive and not great.,1
Paid too much for the quality.,1
Costs more than they're worth.,1
Not a good value at this price.,1
Pricey and not worth it.,1
Paid too much for what they are.,1
Overpriced and not great.,1
Too high-priced for the quality.,1
Not worth the high price tag.,1
Expensive for what you get.,1
Price doesn't match the quality.,1
Overpriced and disappointing.,1
Paid more than they're worth.,1
Not worth the steep price.,1
Too costly for this quality.,1
Overpriced and not worth the money.,1
Quality doesn't justify the high price.,1
Too expensive for these pants.,1
Not a good deal at this price.,1
Paid too much for the quality.,1
Overpriced and not good.,1
Too expensive and not worth it.,1
Costs more than they're worth.,1
Price is too high for what they are.,1
Not worth the high price.,1
Overpriced for this quality.,1
Too costly for what you get.,1
Paid too much for these pants.,1
Not worth the price I paid.,1
Too high-priced for this quality.,1
Overpriced and disappointing quality.,1
Paid too much for what they are.,1
Not a good value at this price.,1
Too expensive and not great quality.,1
Excellent price for such comfortable shoes.,1
Great value for money!,1
Affordable and durable.,1
Perfect price for everyday wear.,1
High quality at a low price.,1
Best deal on shoes I've found.,1
Superb price for this quality.,1
Amazing price for such comfortable shoes.,1
Incredible value for a great product.,1
Worth every penny.,1
Perfectly priced for the quality.,1
Great shoes for an affordable price.,1
A steal at this price.,1
Fantastic value!,1
Affordable and stylish.,1
Highly recommend for the price.,1
Unbeatable price for this quality.,1
Great bargain!,1
Very reasonably priced.,1
Price is excellent for what you get.,1
Thrilled with the price and quality.,1
Such a great deal!,1
Outstanding value.,1
Super affordable and comfy.,1
Best value for shoes.,1
Great find at this price.,1
Price is just right.,1
Love the quality for the price.,1
So happy with this purchase!,1
Couldn't ask for a better price.,1
Cheap but high quality.,1
Perfect price for my budget.,1
Very pleased with the price.,1
Amazing deal on shoes.,1
Affordable and well-made.,1
Great price for such comfortable shoes.,1
Excellent quality at a low price.,1
Budget-friendly and stylish.,1
Such good value for the price.,1
Fantastic price for basic shoes.,1
Quality is excellent for the price.,1
Price is amazing for this quality.,1
Best price for shoes.,1
Affordable and durable.,1
Very happy with the price.,1
Great quality at an affordable price.,1
Can't beat this price!,1
So affordable and comfy.,1
Price is perfect for what you get.,1
Excellent value for money.,1
Very impressed with the price.,1
Such a bargain!,1
Great shoes at a great price.,1
Affordable and fashionable.,1
Best price for quality shoes.,1
Price is unbeatable.,1
Fantastic deal on great shoes.,1
Quality far exceeds the price.,1
Very reasonably priced.,1
Such an affordable price for this quality.,1
Great value for basic shoes.,1
Superb price for such quality.,1
Affordable and comfy.,1
Price is just right for this quality.,1
Excellent quality for a low price.,1
Great price for great shoes.,1
Very happy with this deal.,1
Price is fantastic for what you get.,1
Affordable and well-made.,1
Incredible value for the price.,1
Price is excellent for this quality.,1
Super happy with the price.,1
Great shoes at an amazing price.,1
Very affordable and stylish.,1
Best value for this quality.,1
Perfect price for what you get.,1
Can't beat this deal.,1
Such a good price for this quality.,1
Very pleased with the price.,1
Excellent value for shoes.,1
Affordable and cute.,1
Price is amazing for what you get.,1
Great deal on shoes.,1
Price is just right for this quality.,1
Fantastic value for money.,1
Very affordable and comfy.,1
Superb price for great shoes.,1
Affordable and high quality.,1
Great shoes for an unbeatable price.,1
Very pleased with this deal.,1
Price is fantastic for this quality.,1
Affordable and stylish.,1
Best price for quality shoes.,1
Perfectly priced for the quality.,1
Great deal on quality shoes.,1
Amazing price for this quality.,1
Very happy with this purchase.,1
Affordable and well-made.,1
Price is just right for this quality.,1
Excellent value for basic shoes.,1
Too expensive for what they are.,1
Overpriced for the quality.,1
Not worth the high price.,1
Quality doesn't match the price.,1
Paid too much for these shoes.,1
Pricey and not worth it.,1
Way too expensive for shoes.,1
